{
  "name": "statblock",
  "form": "block",
  "kind": "data",
  "breakable": false,
  "attributes": [{ "name": "system", "type": "string" }],
  "fields": [
    { "name": "name", "type": "string", "required": true, "plain": true },
    { "name": "ac", "type": "number" },
    { "name": "hp", "type": "string" },
    {
      "name": "traits",
      "type": "list",
      "items": {
        "name": "trait",
        "type": "object",
        "fields": [
          { "name": "name", "type": "string", "required": true, "plain": true },
          { "name": "text", "type": "string" }
        ]
      }
    }
  ]
}
